{
  "reportVersion": "1",
  "validatorVersion": "0.1.0",
  "profileVersion": "1",
  "dtcgReportVersion": "2025.10",
  "runtimeIdentity": {
    "pythonVersion": "3.12.10",
    "pythonImplementation": "CPython",
    "platform": "win32"
  },
  "dependencyVersions": {
    "jsonschema": "4.26.0",
    "rfc8785": "0.1.4"
  },
  "executionIdentity": {
    "executedBy": "Claude (scoped executor)",
    "executionContext": "CDS-WP-013 offline fixture harness",
    "evidenceClass": "executor-produced, pre-commit, not independently reviewed"
  },
  "repositoryRevision": "943229dcda15bcc2b4963a55222f6d2c3a4a75eb",
  "worktreeState": "modified worktree",
  "offlineMode": true,
  "schemaIds": {
    "token-document": "tag:github.com,2026:KayKaspers/Core-Design-System/schema/cds-token-document/1",
    "source-set-manifest": "tag:github.com,2026:KayKaspers/Core-Design-System/schema/cds-source-set-manifest/1",
    "resolver-document": "tag:github.com,2026:KayKaspers/Core-Design-System/schema/cds-resolver-document/1",
    "validation-case": "tag:github.com,2026:KayKaspers/Core-Design-System/schema/cds-validation-case/1",
    "validation-result": "tag:github.com,2026:KayKaspers/Core-Design-System/schema/cds-validation-result/1"
  },
  "startedAtUtc": "2026-07-18T12:08:58Z",
  "completedAtUtc": "2026-07-18T12:08:58Z",
  "cases": [
    {
      "caseId": "VAL-CASE-001",
      "fixturePaths": [
        "tests/fixtures/machine-readable/positive/reference-set.tokens.json"
      ],
      "classification": "positive",
      "expected": {
        "V1": "Pass",
        "V2": "Pass",
        "V3": "Pass",
        "V4": "Not applicable with rationale"
      },
      "actual": {
        "V1": "Pass",
        "V2": "Pass",
        "V3": "Pass",
        "V4": "Not applicable with rationale"
      },
      "expectedMatch": true,
      "blockingLayer": "none",
      "diagnostics": [],
      "contentDigests": {
        "tests/fixtures/machine-readable/positive/reference-set.tokens.json": "sha256:10b6f5417a0a0fe51aeeb96c620250daf092c099002337d801b3083978da2b82"
      },
      "sourceRevisions": {
        "tests/fixtures/machine-readable/positive/reference-set.tokens.json": "fixture-rev-0001-synthetic"
      },
      "executionStatus": "executed"
    },
    {
      "caseId": "VAL-CASE-002",
      "fixturePaths": [
        "tests/fixtures/machine-readable/positive/semantic-set.tokens.json"
      ],
      "classification": "positive",
      "expected": {
        "V1": "Pass",
        "V2": "Pass",
        "V3": "Pass",
        "V4": "Not applicable with rationale"
      },
      "actual": {
        "V1": "Pass",
        "V2": "Pass",
        "V3": "Pass",
        "V4": "Not applicable with rationale"
      },
      "expectedMatch": true,
      "blockingLayer": "none",
      "diagnostics": [],
      "contentDigests": {
        "tests/fixtures/machine-readable/positive/semantic-set.tokens.json": "sha256:591ee007c334517f4bb1e0d14c0dc7f9466f08f24d7e80957b90e0053d2cf886"
      },
      "sourceRevisions": {
        "tests/fixtures/machine-readable/positive/semantic-set.tokens.json": "fixture-rev-0001-synthetic"
      },
      "executionStatus": "executed"
    },
    {
      "caseId": "VAL-CASE-003",
      "fixturePaths": [
        "tests/fixtures/machine-readable/positive/component-set.tokens.json"
      ],
      "classification": "positive",
      "expected": {
        "V1": "Pass",
        "V2": "Pass",
        "V3": "Pass",
        "V4": "Not applicable with rationale"
      },
      "actual": {
        "V1": "Pass",
        "V2": "Pass",
        "V3": "Pass",
        "V4": "Not applicable with rationale"
      },
      "expectedMatch": true,
      "blockingLayer": "none",
      "diagnostics": [],
      "contentDigests": {
        "tests/fixtures/machine-readable/positive/component-set.tokens.json": "sha256:7080d8547ba3e5c9d77b413d0ff13c5540093ba51da3018b0c9db8935e837bad"
      },
      "sourceRevisions": {
        "tests/fixtures/machine-readable/positive/component-set.tokens.json": "fixture-rev-0001-synthetic"
      },
      "executionStatus": "executed"
    },
    {
      "caseId": "VAL-CASE-004",
      "fixturePaths": [
        "tests/fixtures/machine-readable/positive/product-profile-set.tokens.json"
      ],
      "classification": "positive",
      "expected": {
        "V1": "Pass",
        "V2": "Pass",
        "V3": "Pass",
        "V4": "Not applicable with rationale"
      },
      "actual": {
        "V1": "Pass",
        "V2": "Pass",
        "V3": "Pass",
        "V4": "Not applicable with rationale"
      },
      "expectedMatch": true,
      "blockingLayer": "none",
      "diagnostics": [],
      "contentDigests": {
        "tests/fixtures/machine-readable/positive/product-profile-set.tokens.json": "sha256:2e98d58c107b6514a055f7da40213acec316b45c0ef81fca2ae67c7c5d8a222b"
      },
      "sourceRevisions": {
        "tests/fixtures/machine-readable/positive/product-profile-set.tokens.json": "fixture-rev-0001-synthetic"
      },
      "executionStatus": "executed"
    },
    {
      "caseId": "VAL-CASE-005",
      "fixturePaths": [
        "tests/fixtures/machine-readable/positive/source-set-manifest.source-set.json"
      ],
      "classification": "positive",
      "expected": {
        "V1": "Pass",
        "V2": "Not applicable with rationale",
        "V3": "Pass",
        "V4": "Not applicable with rationale"
      },
      "actual": {
        "V1": "Pass",
        "V2": "Not applicable with rationale",
        "V3": "Pass",
        "V4": "Not applicable with rationale"
      },
      "expectedMatch": true,
      "blockingLayer": "none",
      "diagnostics": [],
      "contentDigests": {
        "tests/fixtures/machine-readable/positive/source-set-manifest.source-set.json": "sha256:d8d6a819727639dc948d96747a3dc536d1969fed1e9dbfb654d0cd03b24b7e0f"
      },
      "sourceRevisions": {
        "tests/fixtures/machine-readable/positive/source-set-manifest.source-set.json": "fixture-rev-0001-synthetic"
      },
      "executionStatus": "executed"
    },
    {
      "caseId": "VAL-CASE-006",
      "fixturePaths": [
        "tests/fixtures/machine-readable/positive/resolver.resolver.json"
      ],
      "classification": "positive",
      "expected": {
        "V1": "Pass",
        "V2": "Pass",
        "V3": "Pass",
        "V4": "Not applicable with rationale"
      },
      "actual": {
        "V1": "Pass",
        "V2": "Pass",
        "V3": "Pass",
        "V4": "Not applicable with rationale"
      },
      "expectedMatch": true,
      "blockingLayer": "none",
      "diagnostics": [],
      "contentDigests": {
        "tests/fixtures/machine-readable/positive/resolver.resolver.json": "sha256:10354d499844eee7f2b8884b3079cf9c334c554ddcd44f4ba5d9e77371a7eafb"
      },
      "sourceRevisions": {
        "tests/fixtures/machine-readable/positive/resolver.resolver.json": "fixture-rev-0001-synthetic"
      },
      "executionStatus": "executed"
    },
    {
      "caseId": "VAL-CASE-007",
      "fixturePaths": [
        "tests/fixtures/machine-readable/positive/reference-set.tokens.json",
        "tests/fixtures/machine-readable/positive/semantic-set.tokens.json",
        "tests/fixtures/machine-readable/positive/component-set.tokens.json",
        "tests/fixtures/machine-readable/positive/product-profile-set.tokens.json",
        "tests/fixtures/machine-readable/positive/source-set-manifest.source-set.json",
        "tests/fixtures/machine-readable/positive/resolver.resolver.json"
      ],
      "classification": "positive",
      "expected": {
        "V1": "Pass",
        "V2": "Pass",
        "V3": "Pass",
        "V4": "Not applicable with rationale"
      },
      "actual": {
        "V1": "Pass",
        "V2": "Pass",
        "V3": "Pass",
        "V4": "Not applicable with rationale"
      },
      "expectedMatch": true,
      "blockingLayer": "none",
      "diagnostics": [],
      "contentDigests": {
        "tests/fixtures/machine-readable/positive/reference-set.tokens.json": "sha256:10b6f5417a0a0fe51aeeb96c620250daf092c099002337d801b3083978da2b82",
        "tests/fixtures/machine-readable/positive/semantic-set.tokens.json": "sha256:591ee007c334517f4bb1e0d14c0dc7f9466f08f24d7e80957b90e0053d2cf886",
        "tests/fixtures/machine-readable/positive/component-set.tokens.json": "sha256:7080d8547ba3e5c9d77b413d0ff13c5540093ba51da3018b0c9db8935e837bad",
        "tests/fixtures/machine-readable/positive/product-profile-set.tokens.json": "sha256:2e98d58c107b6514a055f7da40213acec316b45c0ef81fca2ae67c7c5d8a222b",
        "tests/fixtures/machine-readable/positive/source-set-manifest.source-set.json": "sha256:d8d6a819727639dc948d96747a3dc536d1969fed1e9dbfb654d0cd03b24b7e0f",
        "tests/fixtures/machine-readable/positive/resolver.resolver.json": "sha256:10354d499844eee7f2b8884b3079cf9c334c554ddcd44f4ba5d9e77371a7eafb"
      },
      "sourceRevisions": {
        "tests/fixtures/machine-readable/positive/reference-set.tokens.json": "fixture-rev-0001-synthetic",
        "tests/fixtures/machine-readable/positive/semantic-set.tokens.json": "fixture-rev-0001-synthetic",
        "tests/fixtures/machine-readable/positive/component-set.tokens.json": "fixture-rev-0001-synthetic",
        "tests/fixtures/machine-readable/positive/product-profile-set.tokens.json": "fixture-rev-0001-synthetic",
        "tests/fixtures/machine-readable/positive/source-set-manifest.source-set.json": "fixture-rev-0001-synthetic",
        "tests/fixtures/machine-readable/positive/resolver.resolver.json": "fixture-rev-0001-synthetic"
      },
      "executionStatus": "executed"
    },
    {
      "caseId": "VAL-CASE-008",
      "fixturePaths": [
        "tests/fixtures/machine-readable/negative/duplicate-key.tokens.json"
      ],
      "classification": "negative",
      "expected": {
        "V1": "Fail",
        "V2": "Not assessed",
        "V3": "Not assessed",
        "V4": "Not assessed"
      },
      "actual": {
        "V1": "Fail",
        "V2": "Not assessed",